results/tables/top50_annotated_genes.tsv

gene_id	ensembl_gene_id	gene_symbol	entrez_id	gene_name	baseMean	log2FoldChange	lfcSE	pvalue	padj	significant
ENSG00000167900	ENSG00000167900	TK1	7083	thymidine kinase 1	463.6970327066684	3.1122522944589215	0.20416529995754457	1.1381711291240359e-53	1.7653034212713795e-49	upregulated
ENSG00000171848	ENSG00000171848	RRM2	6241	ribonucleotide reductase regulatory subunit M2	848.028228811473	3.713343043955423	0.2524265880163579	2.775710382681556e-50	2.1525634017695462e-46	upregulated
ENSG00000166851	ENSG00000166851	PLK1	5347	polo like kinase 1	185.8299427570159	3.772785220470218	0.2570003281210797	5.052564903968254e-50	2.612176055351587e-46	upregulated
ENSG00000175063	ENSG00000175063	UBE2C	11065	ubiquitin conjugating enzyme E2 C	141.78225285882635	3.45925068751281	0.24847060842844465	2.6376445875303844e-45	1.0227466888149061e-41	upregulated
ENSG00000145386	ENSG00000145386	CCNA2	890	cyclin A2	180.14011019396384	3.64084735444603	0.26515361599293774	3.9092527556663555e-44	1.2126502048077035e-40	upregulated
ENSG00000111206	ENSG00000111206	FOXM1	2305	forkhead box M1	90.22473201070602	2.9818712416966795	0.2179145703009026	7.731838162461245e-44	1.998680164996232e-40	upregulated
ENSG00000165949	ENSG00000165949	IFI27	3429	interferon alpha inducible protein 27	3924.850507470494	8.550506750838599	0.6258994074174159	1.0359158045427832e-43	2.1914415657063247e-40	upregulated
ENSG00000088325	ENSG00000088325	TPX2	22974	TPX2 microtubule nucleation factor	225.8004877919205	3.062140267801749	0.2243027405461739	1.1303373646454284e-43	2.1914415657063247e-40	upregulated
ENSG00000178999	ENSG00000178999	AURKB	9212	aurora kinase B	118.82759812767368	3.108790120979148	0.23103194100941163	1.573862086411696e-42	2.7122889955828235e-39	upregulated
ENSG00000117399	ENSG00000117399	CDC20	991	cell division cycle 20	227.9995481254343	3.547421347657454	0.26615697039169955	8.827389492864529e-42	1.3691281103432886e-38	upregulated
ENSG00000123485	ENSG00000123485	HJURP	55355	Holliday junction recognition protein	86.74024627482258	3.1283766101184445	0.2384474843433147	1.5322519175232474e-40	2.160475203707779e-37	upregulated
ENSG00000127564	ENSG00000127564	PKMYT1	9088	protein kinase, membrane associated tyrosine/threonine 1	115.09823259471308	3.108810154200935	0.240653877125016	2.0461089571822996e-39	2.6445958271581223e-36	upregulated
ENSG00000148773	ENSG00000148773	MKI67	4288	marker of proliferation Ki-67	560.3976403171973	3.0556456425091083	0.23745225854194468	4.2347125756072906e-39	5.052337849820699e-36	upregulated
ENSG00000211950	ENSG00000211950	IGHV1-24	28467	immunoglobulin heavy variable 1-24	1310.84767153997	5.68770297323546	0.4430890650035972	5.37887510277012e-39	5.959025203140327e-36	upregulated
ENSG00000089685	ENSG00000089685	BIRC5	332	baculoviral IAP repeat containing 5	234.69319771783228	3.72383779373672	0.29077405728903677	8.370058089325017e-39	8.654640064362069e-36	upregulated
ENSG00000090889	ENSG00000090889	KIF4A	24137	kinesin family member 4A	52.93257083547675	3.4043558516809695	0.26573416360287155	9.78521876016131e-39	9.485546435631372e-36	upregulated
ENSG00000171241	ENSG00000171241	SHCBP1	79801	SHC binding and spindle associated 1	195.11625906669417	3.1003162278913727	0.2426644283884184	1.2843943089031795e-38	1.171820925358136e-35	upregulated
ENSG00000143476	ENSG00000143476	DTL	51514	denticleless E3 ubiquitin protein ligase homolog	139.69430100015057	3.0529536933052928	0.24195651582840869	9.48637604796597e-38	7.743878552839589e-35	upregulated
ENSG00000170476	ENSG00000170476	MZB1	51237	marginal zone B and B1 cell specific protein	1864.6532808712916	3.546154084076947	0.2811106964636867	9.247354831654704e-38	7.743878552839589e-35	upregulated
ENSG00000066279	ENSG00000066279	ASPM	259266	assembly factor for spindle microtubules	83.98052212222613	2.865410893390832	0.22730792519004897	1.2718480690664742e-37	9.863181775610507e-35	upregulated
ENSG00000224373	ENSG00000224373	IGHV4-59	28392	immunoglobulin heavy variable 4-59	1059.6279643592256	3.685441520881347	0.2929743514210847	1.4962853490130794e-37	1.1051136077710886e-34	upregulated
ENSG00000169679	ENSG00000169679	BUB1	699	BUB1 mitotic checkpoint serine/threonine kinase	232.17400322357452	3.0137780703388537	0.24304565489032495	1.449626372623115e-36	1.021986592699296e-33	upregulated
ENSG00000276043	ENSG00000276043	UHRF1	29128	ubiquitin like with PHD and ring finger domains 1	227.5298664660977	2.7008141607451144	0.2188959418385504	3.2142791890386326e-36	2.1675421835647475e-33	upregulated
ENSG00000184357	ENSG00000184357	H1-5	3009	H1.5 linker histone, cluster member	67.26375827791337	3.1573263085380323	0.25973057672415056	3.2535160852794727e-35	2.102584770111859e-32	upregulated
ENSG00000157456	ENSG00000157456	CCNB2	9133	cyclin B2	147.51217682814686	3.3099844748453098	0.27776769199775403	5.488849272592075e-34	3.405282088716123e-31	upregulated
ENSG00000167513	ENSG00000167513	CDT1	81620	chromatin licensing and DNA replication factor 1	96.4358787242481	2.6794793793643934	0.22509431665849933	6.555051115302119e-34	3.9103401076283032e-31	upregulated
ENSG00000211896	ENSG00000211896	IGHG1	3500	immunoglobulin heavy constant gamma 1 (G1m marker)	47300.98908219396	5.138355737315439	0.4342564884897314	1.4098398658994551e-33	8.098746785222426e-31	upregulated
ENSG00000112984	ENSG00000112984	KIF20A	10112	kinesin family member 20A	64.67682005801578	3.380532870518873	0.28760681208285316	4.287164303349048e-33	2.2934903948638232e-30	upregulated
ENSG00000135476	ENSG00000135476	ESPL1	9700	extra spindle pole bodies like 1, separase	65.63631353604791	2.719038726249161	0.231323318215382	4.288279913027136e-33	2.2934903948638232e-30	upregulated
ENSG00000187837	ENSG00000187837	H1-2	3006	H1.2 linker histone, cluster member	419.0138746015347	1.7791348199876558	0.1523828114686381	1.160331984250052e-32	5.9989163585727695e-30	upregulated
ENSG00000131747	ENSG00000131747	TOP2A	7153	DNA topoisomerase II alpha	371.1652073730015	3.059314733060484	0.26430678254013634	3.065118901933619e-32	1.533548198999691e-29	upregulated
ENSG00000065328	ENSG00000065328	MCM10	55388	minichromosome maintenance 10 replication initiation factor	96.20994238001822	3.3919081018333586	0.2940612543451892	5.384416607967558e-32	2.609759424674276e-29	upregulated
ENSG00000101057	ENSG00000101057	MYBL2	4605	MYB proto-oncogene like 2	959.829616521588	3.315228648121862	0.28811905094782864	6.611407522994061e-32	3.1073615358072086e-29	upregulated
ENSG00000131153	ENSG00000131153	GINS2	51659	GINS complex subunit 2	114.1908757073998	2.6994562889858984	0.23489152299205068	8.53836210062952e-32	3.8949998876695255e-29	upregulated
ENSG00000122952	ENSG00000122952	ZWINT	11130	ZW10 interacting kinetochore protein	294.2025148432771	2.2718319844592463	0.19864345467614777	1.6670105449644326e-31	7.387238157828101e-29	upregulated
ENSG00000211945	ENSG00000211945	IGHV1-18	28468	immunoglobulin heavy variable 1-18	1013.105646182788	3.542766988412914	0.31200793834240215	3.787495569026834e-31	1.6317793409890612e-28	upregulated
ENSG00000075218	ENSG00000075218	GTSE1	51512	G2 and S-phase expressed 1	55.01533359237482	2.99769944453504	0.26478095041150274	6.359229964846726e-31	2.665720452831695e-28	upregulated
ENSG00000115163	ENSG00000115163	CENPA	1058	centromere protein A	35.86770215811476	3.4859958383491145	0.3079877943644206	7.4445941089234795e-31	3.0385698586685047e-28	upregulated
ENSG00000184661	ENSG00000184661	CDCA2	157313	cell division cycle associated 2	66.15857050305495	3.2669704454049655	0.2912538607196494	2.0027465792889327e-30	7.964769088402909e-28	upregulated
ENSG00000146670	ENSG00000146670	CDCA5	113130	cell division cycle associated 5	106.53068661784908	2.7587617163375495	0.24622892446890032	2.2862048336501287e-30	8.864759242478374e-28	upregulated
ENSG00000092853	ENSG00000092853	CLSPN	63967	claspin	88.49287503688731	2.539679397519341	0.2270669430470947	2.8189516129388358e-30	1.0663887686995451e-27	upregulated
ENSG00000138180	ENSG00000138180	CEP55	55165	centrosomal protein 55	69.57904239992794	3.344593212619552	0.2991550767501029	3.1820136164729724e-30	1.1750721712260909e-27	upregulated
ENSG00000126787	ENSG00000126787	DLGAP5	9787	DLG associated protein 5	94.34401638279432	3.686525937045351	0.33007516974327433	3.5085568553377066e-30	1.2655282982857636e-27	upregulated
ENSG00000109805	ENSG00000109805	NCAPG	64151	non-SMC condensin I complex subunit G	89.61039347957114	3.107592963845192	0.2787276392329328	4.138956503375719e-30	1.458982167439941e-27	upregulated
ENSG00000156970	ENSG00000156970	BUB1B	701	BUB1 mitotic checkpoint serine/threonine kinase B	70.40442251852478	2.681712666519338	0.24328615534735223	1.6825964147895406e-29	5.799348976307951e-27	upregulated
ENSG00000211962	ENSG00000211962	IGHV1-46	28465	immunoglobulin heavy variable 1-46	1000.4414532814252	3.4090516359157563	0.3095624241742535	1.8754290227882715e-29	6.3234574224882805e-27	upregulated
ENSG00000142945	ENSG00000142945	KIF2C	11004	kinesin family member 2C	103.751838526438	2.795536117179117	0.2552969090409235	3.764756593297541e-29	1.2423696757881883e-26	upregulated
ENSG00000135451	ENSG00000135451	TROAP	10024	trophinin associated protein	60.43450136552118	3.3017823798497976	0.30201709714293506	4.6001594240789925e-29	1.4864265139055242e-26	upregulated
ENSG00000093009	ENSG00000093009	CDC45	8318	cell division cycle 45	106.90321465574732	2.9142240414150105	0.2673812126534295	6.833410371776949e-29	2.1629835686991932e-26	upregulated
ENSG00000183010	ENSG00000183010	PYCR1	5831	pyrroline-5-carboxylate reductase 1	81.73438152750525	3.0604972606881407	0.28158304929826705	9.377017220702311e-29	2.9087507418618567e-26	upregulated

results/analysis_notes.md

## Top-ranked genes by adjusted p-value

- ENSG00000167900: log2FC = 3.112, padj = 1.77e-49
- ENSG00000171848: log2FC = 3.713, padj = 2.15e-46
- ENSG00000166851: log2FC = 3.773, padj = 2.61e-46
- ENSG00000175063: log2FC = 3.459, padj = 1.02e-41
- ENSG00000145386: log2FC = 3.641, padj = 1.21e-40
- ENSG00000111206: log2FC = 2.982, padj = 2e-40
- ENSG00000165949: log2FC = 8.551, padj = 2.19e-40
- ENSG00000088325: log2FC = 3.062, padj = 2.19e-40
- ENSG00000178999: log2FC = 3.109, padj = 2.71e-39
- ENSG00000117399: log2FC = 3.547, padj = 1.37e-38